{
  "run_id": "20250924235645",
  "release_tag": "v1.0.0-20250924140500",
  "pre_snapshot_manifest": "audit/releases/v1.0.0-20250924140500/manifest.json",
  "cosign_verify": {
    "status": "success",
    "output": "Verification for audit/releases/v1.0.0-20250924140500/manifest.json --\nThe following checks were performed on each of these signatures:\n  - The cosign claims were validated\n  - Existence of the claims in the transparency log was verified offline\n  - The signatures were verified against the specified public key"
  },
  "rollback_action": "kubectl rollout undo deployment/mysvc",
  "post_health": {
    "status": "healthy",
    "response": {
      "status": "ok",
      "timestamp": "2025-09-24T14:05:00Z"
    }
  },
  "checksums_verify": {
    "ok": true,
    "errors": []
  }
}
